pmid,pmcid,doi,issn,journal_title,article_title,last_revised,published,live,release_date,license,pubmed_ftp_link,filepath
37417730,PMC10356134,10.7554/eLife.88310,2050-084X,eLife,Metformin regulates bone marrow stromal cells to accelerate bone healing in diabetic mice.,2023-07-21,2023-07-07,True,,CC BY,ftp://ftp.ncbi.nlm.nih.gov/pub/pmc/oa_package/5e/82/PMC10356134.tar.gz,"pubmed_abstracts/PMC10356134/elife-88310-mdarchecklist1.pdf,pubmed_abstracts/PMC10356134/elife-88310.pdf"
37417729,PMC10508548,10.1002/vms3.1196,2053-1095,Veterinary medicine and science,Global prevalence of Neospora caninum in rodents: A systematic review and meta-analysis.,2023-09-21,2023-09-01,True,,CC BY,ftp://ftp.ncbi.nlm.nih.gov/pub/pmc/oa_package/1d/b2/PMC10508548.tar.gz,pubmed_abstracts/PMC10508548/VMS3-9-2192.pdf
37417731,,,1520-6890,Chemical reviews,Enantioselective Transformations in the Synthesis of Therapeutic Agents.,2023-08-30,2023-08-09,False,,,,pubmed_abstracts/37417731.txt
37417732,,,1948-7185,The journal of physical chemistry letters,Reduction-Active Antisolvent: A Universal and Innovative Strategy of Further Ameliorating Additive Optimization for High Efficiency Perovskite Solar Cells.,2023-07-20,2023-Jul-20,False,,,,pubmed_abstracts/37417732.txt
37417734,PMC10328535,10.7554/eLife.86373,2050-084X,eLife,The Opto-inflammasome in zebrafish as a tool to study cell and tissue responses to speck formation and cell death.,2023-11-16,2023-Jul-07,True,,CC BY,ftp://ftp.ncbi.nlm.nih.gov/pub/pmc/oa_package/b9/9f/PMC10328535.tar.gz,pubmed_abstracts/PMC10328535/elife-86373.pdf
37417733,PMC10392983,10.7554/eLife.88058,2050-084X,eLife,Allosteric activation or inhibition of PI3Kγ mediated through conformational changes in the p110γ helical domain.,2023-11-16,2023-Jul-07,True,,CC BY,ftp://ftp.ncbi.nlm.nih.gov/pub/pmc/oa_package/91/25/PMC10392983.tar.gz,"pubmed_abstracts/PMC10392983/elife-88058.pdf,pubmed_abstracts/PMC10392983/elife-88058-mdarchecklist1.pdf"
37417737,PMC10731660,10.1021/acs.inorgchem.3c01620,1520-510X,Inorganic chemistry,Role of Pure Technetium Chemistry: Are There Still Links to Applications in Imaging?,2023-07-07,2023-Jul-07,True,,CC BY,ftp://ftp.ncbi.nlm.nih.gov/pub/pmc/oa_package/14/5f/PMC10731660.tar.gz,pubmed_abstracts/PMC10731660/ic3c01620.pdf
